,id,rating,review
784,797,6,"Góð saga. hugaverð  myndir byggðar á sannsögulegum atburðum eru alltaf sérstaklega spennandi. Drama, en líka fínn húmor inn á milli. essi WWEglímu heimur er mjög sérstakur  magnað hvað þetta er stórt batterí. Skemmtileg mynd."
785,798,5,Fínasta actionstórslysamynd. En nokkuð einfalt handrit  formúlukennt... Góð afþreying.
786,799,8,Gott action og góður húmor  topp afþreying. Spennandi. Að vissu leyti hefðbundin Marvel mynd  en þetta er alveg formúla sem virkar. Skemmtileg origin saga. Lagði góðan grunn að Avengers: Endgame. g var að fíla s tónlistina og í rauninni alla s stemninguna.
787,800,7,Töff vigilante mynd. Spennandi. Gott action.
788,801,4,Skrýtinflippuð mynd  Willy Wonka var smá creepy. Meira krakkamynd  húmor í stíl við það.
789,802,5,Spennandi vigilante mynd.  köflum var handritið ekki alveg nógu metnaðarfullt. Smá gore  enda Eli Roth að leikstýra. að var áhugavert að sjá að það komu  framhaldsmyndir af upprunalegu myndinni frá  með Charles Bronson.
790,803,5,Fyndin vitleysa. Skemmtilegt grín að öllum þessum romcom klisjum.
791,804,6,"Spennandi scifi mynd. Skemmtilega öðruvísi  ekki týpísk Hollywood mynd, heldur meira svona indiebragur. Smá Cloverfield vibe  eitthvað hrátt við þessa mynd. hugavert plot."
792,805,6,"Spennandi  mjög dramatísk og stressandi á köflum. Dwayne frændi er alltaf solid. Skemmtileg tilbreyting að vondi kallinn er skandinavískur, en ekki rússneskur. Nokkuð formúlukennd mynd, en samt ágætlega frumleg stórslysamynd  mögnuð bygging."
793,806,8,Mjög spennandi mynd. Intense. Sniðugt concept  minnti mig á Buried með Ryan Reynolds þar sem allur fókusinn er á einn leikara og svo það sem heyrist í símanum og að þurfa að koma ýmsu á framfæri bara með hljóði. Gott stöff  gott handrit.
794,807,8,Virkilega hryllileg hryllingsmynd! Brjálæðislega creepy og ógnvekjandi. Svakalega spennandi. g var alveg á nálum ? En hún var alveg lúmskt fyndin á köflum  enda Jordan Peele grínsnillingur. Mjög áhugavert handrit  mikið af ósvöruðum spurningum. Gott stöff. Vel gerð.
795,808,7,Mjög áhugaverð saga  ýmislegt sem ég vissi ekki um Freddie Mercury og Queen. Góð tónlist  góð stemning. Drama. Góðir leikarar.
796,809,7,Mjög spennandi. hugavert plot. Gaman að sjá Netflix myndir sem er mikið lagt í.
797,810,6,Mjög áhugaverð saga. Magnað hvað þetta komst langt... Fake it till you make it hefur kannski einhver mörk ???? 
798,811,1,"Speisuð og skrýtin mynd. Svo psycho. Margar hægar senur. Mikið af WTF mómentum. Eins og það sé verið að reyna gera artý mynd  low budget, þannig að þetta var smá eins og verkefni hjá listaháskólanemum. Handritið var ekki upp á marga fiska  samtölin voru oft kjánaleg og flæðið á milli atriða var stundum skrýtið. Excessive gore. Fyndiðáhugavert að sjá Elijah Wood sem framleiðanda. Jóhann Jóhannsson gerði tónlistina  fallegt að það kom In Loving Memory of our friend í lokinn."
799,812,7,Eitthvað Disneylegt við þetta í byrjun  klisjukenntformúlukennt. En fór svo almennilega í gang. Mjög spennandi á köflum. Dramatísk. Fín afþreying.
800,813,6,"Spennandi. Týpísk ofurhetjuXMen mynd. Horfði á þetta í flugvél og þannig myndir eru oft klipptar öðruvísi, censoraðar og mér fannst eitt og annað off í tengslum við það. gætlega áhugaverð origin saga. Sumir ofurkraftar hjá krökkunum voru smá fyndnirspes."
801,814,9,"EPSKUR endir! Svakaleg mynd. Geggjuð og risastór action atriði. Mjög spennandi. Líka mjög fyndin ..og dramatísk. Allar tilfinningarnar. Magnað og virkilega gaman að sjá allar þessar persónur saman komnar. Verður spennandi að sjá hvað gerist næst í Marvel heiminum. 

g fór á myndina í DX sal í Orlando sem var áhugaverð upplifun  stóllinn hreyfðist og titraði, það kom vindur, rigning, blóðslettur, snjór og eldingarflass, maður var laminn í bakið o.s.frv. Gaman að prófa þetta en þetta var smá gimmicky  maður var í rauninni kominn í tívolítæki."
802,815,8,Svo. Mikið. Ofbeldi. Svakaleg keyrsla. Keanu Reeves er svo góður í þessu hlutverki. Gaman líka að aðrir fengu að skína í svona ég ætla að drepa  manns á  mínútum rússíbönum. hugaverður ævintýraheimur með gamaldags tækni  stíl inn á milli í nútímanum. Skemmtileg listræn stjórnun  mikið um cool vibes.
803,816,6,Skemmtilega nýtt og öðruvísi. etta er sem sagt svona POV VR stuttmynd  vissulega kúlfaktor af því að ég hafði ekki horft áður á svona. Handritið var nokkuð takmarkað og klisjukennt en þetta var samt fínasta afþreying. Stundum fannst mér skrýtið þegar þau voru að óþörfu að brjóta POV vegginn  truflaði flæðið smá. En myndin var spennandi á köflum og skemmtilega immersive upplifun. að verður gaman að fylgjast með hvort það komi mikið af svona VR Hollywood myndum í framtíðinni.
804,817,7,Mjög fyndin og spennandi mynd. g var að dýrka allar vísanirnar í gömlu myndina  og öll þessi cameos. Topp skemmtun.
805,818,6,Fyndin vitleysa. Spennandi. Alltaf gaman að sjá laf Darra. Fínasta afþreying.
806,819,7,Spennandi. hugaverðar persónur. Flottir leikarar.
807,820,6,"Klassísk Marvel mynd  spennandi, fyndin og fínt action. En ekki eins mögnuð og margar aðrar Marvel myndir. hugavert að það voru  gaurar sem skrifuðu handritið  ekki oft sem ég sé svona marga ; Veit ekki hvort það sé endilega betra  mér fannst alla vega ekkert brillíant flæðikeyrsla. Mér fannst einn leikarinn smá líkur Tom Hardy og var í smá stund að pæla hvort það væri einhver tenging við Venom, origin story eða eitthvað þannig  en svo var ekki, þetta var ekki Tom Hardy ;"
808,821,6,hugaverð saga. Spennandi. Fullt af flottum skotum. Skýr skot á pólitíska landslagið núna í USA. Svakalegt að sjá upptökurnar frá  í lokinn. Mér fannst einn leikarinn svo líkur Steve Buscemi  það var sem sagt Michael Joseph bróðir hans.
809,822,6,Spennandi og áhugaverð dystopian scifi mynd.
810,823,4,"Mjög kjánaleg mynd, eins og við mátti búast  bull  vitleysa. En fyndin á köflum."
811,824,7,Mjög áhugaverð frásögn. Magnað dæmi... frekar klikkað ef þetta er allt satt. Topp leikarar.  nokkrum köflum fannst mér tónlistin minna á House of Cards tónlistina  veit ekki hvort það var vísvitandi vísun í sambærileg atriði.
812,825,6,Smá Bmyndar fílingur  ekkert verið að taka sig of alvarlega. Fullt af þekktum leikurum. Spennandi. Handritið var stundum smá takmarkað. En þetta var fínasta afþreying.
813,826,6,"Fín ofurhetjumynd. En það vantaði eitthvað til að gera hana betri  það var eitthvað barnalegt og gamaldags við hana, maður býst við vandaðari ofurhetjumyndum árið . hugavert að sjá að Dwayne Johnson var framleiðandi."
814,827,7,Töff ofurhetjumynd  mjög flottar senur inn á milli. gætis söguþráður  fróðlegt að sjá hvernig þetta þróast eftir Avengers: Endgame. að hafði smá áhrif á upplifunina að sjá myndina í lélegum sal með takmörkuðu surround hljóði.
815,828,7,Gott stöff. Spennandi. Góð keyrsla. Alveg jafn mikil vitleysa og maður bjóst við. Aðeins öðruvísi dýnamík þegar þetta eru aðallega bara þeir tveir en ekki allt FF gengið. Var að fíla scifi vinkilinn.
816,829,7,Spennandi. Heill hellingur af þekktumflottum leikurum. Fullt af flottum skotum. hugavert handrit.
817,830,8,Mjög fyndin. Skemmtileg. Topp afþreying.
818,831,4,Spes mynd. Meira drama en ég bjóst við. Kaldursvarturþurr húmor. hugavert plot.
819,832,8,"Virkilega fín mynd. Mjög áhugaverð saga. Alltaf topp gæði hjá Tarantino. Virkilega góðir leikarar  gaman að sjá usual suspects eða börnin þeirra sem hafa leikið nokkrum sinnum í Tarantino myndum. Ekki eins mikið ofbeldi og oft hjá Quentin, en alveg nóg ???? ???? "
820,833,7,"Fyndin vitleysa. Mikið bull. Ekta afþreying. Að vissu leyti svipuð og Superbad, bara um yngri stráka enda að hluta til sömu gaurarnir sem gerðu þessa."
821,834,8,Geggjuð mynd. Virkilega fyndin og skemmtileg. Góðar týpur. Góðir leikarar. Að vissu leyti eins og stelpuútgáfan af Superbad.
822,835,7,Mjög spennandi mynd. Nóg af action. Góð keyrsla. Gott stöff.  rauninni betri en ég bjóst við. Nick Nolte fór á kostum. etta er svona mynd þar sem handritið þarf ekki að vera fullkomiðgallalaust ???? 
823,836,4,Fyndin. Fín afþreying. En engin snilld.
824,837,6," svona mynd þarf ekkert topp leiklistarhæfileika  handritið og þá sérstaklega samtölin var líka oft frekar takmarkað. Nokkuð langur aðdragandi  en það þurfti að byggja upp smá plott, gefa Rambo ástæðu til að drepa óhóflega mikið af mönnum. Klassísk Rambo sláturvertíð  svakalegt dæmi. Smá Home Alone fílingur ???? En mér fannst töluvert betri keyrsla í Rambo  sem kom út ."
825,838,9,Mögnuð mynd! Virkilega vel gerð. Joaquin Phoenix fór algjörlega á kostum. Maður fann svo fyrir þjáningum persónunnar og hvernig hann var útskúfaður úr samfélaginu vegna geðsjúkdóms hans. Topp mynd. En hún er þung  meira listræn nálgun á þennan heim frekar en hröð keyrsla eins og oft í nýjustu ofurhetjumyndunum. Mjög áhugaverð bakgrunnssaga fyrir Jokerinn. Tónlistin gerði líka svo mikið fyrir stemninguna  Hildur Guðnadóttir er alveg í heimsklassa. Smá svartur húmor  enda Todd Phillips Hangover o.s.frv. að leikstýra. 
826,839,7,"Mjög ánægður með að fá að sjá meira úr Breaking Bad heiminum. Smá langur aðdragandi  frekar hæg á köflum, ekki hröð keyrsla eins og maður myndi kannski búast við í bíómynd. Smá eins og bara langur þáttur. Sem var kannski markmiðið  vildu halda sama stíl. Spennandi og vönduð mynd."
827,840,6,Fyndin vitleysa. Léttmeti. Fín afþreying.
828,841,7,Bull og vitleysa. Mjög súrt. En fyndið. Bloopers með kreditlistanum var samt laaangbesti hlutinn ?  bjargaði alveg myndinni.
829,842,7,"Gott stöff. Góð skemmtun. Spennandi og fyndin  góð blanda. Woody Harrelson er góður karakter  heldur uppi stemningunni. Nokkur góð aukahlutverk. að er alltaf eitthvað skemmtilegt og áhugavert við zombie efni  hvort sem það eru sjónvarpsþættir, kvikmyndir eða tölvuleikir. ? "
830,843,7,Mjög spennandi. Gott action. Linda Hamilton var badass! Gaman að fá meira Terminator efni og sérstaklega skemmtilegt að fá Sarah Connor og T aftur saman. Handritið var frekar týpískt  en ég hafði gaman af þessu.
831,844,7,hugaverð saga. hugaverðar pælingar með Wakanda og Vibranium. Spennandi. Fínt action.
832,845,7,"Klassísk zombie mynd. Spennandi. Fyndin. Hún var meiri snilld í minningunni  en ég var með mega inflúensu þegar ég horfði á hana, þannig að kannski hafði það áhrif á upplifunina."
833,846,6,Frekar klikkuð mynd. Algjört rugl  mikið af WTF atriðum. Fyndin. Spennandi. Plotið minnir mig á aðrar myndir sem ég hef séð  t.d. Very Bad Things.
834,847,8,"Mjög góð mynd. Virkilega áhugaverð saga. Spennandi. Hún var ekki langdregin þótt hún var , klst  það var frá svo mörgu að segja. Magnað leikaraúrval  unaður að sjá þessi legends í þessum hlutverkum. hugavert að sjá hvernig það var búið að yngja þá upp  næstum því trúverðugtfullkomið, en stundum örlítið creepy uncanny valley. Mikið af löngum og hægum yfirveguðum mafíósasamtölum. Fyrsta Netflix myndin sem ég sé í bíó ????"
835,848,8,"Mjög spennandi mynd. Góð keyrsla. Fínasta saga, þótt ég hafi alveg séð sambærilegt plot áður. Eitthvað hrátt við hana  hún var ekki stútfull af tæknibrellum eins og margar myndir núna. Smá old school stemning við þessa mynd  New York löggur að elta bófa og svo eru náttúrulega einhverjar spilltar löggur. Solid mynd. Hélt athyglinni vel  ekki mikið af dauðum punktum. Flottir leikarar."
836,849,7,Mjög spennandi og mjög fyndin mynd. Topp afþreying. Frekar svipaður söguþráður og í síðustu mynd  með smá auka viðbót sem var alveg áhugavert og skemmtilegt.
837,850,7,"Spennandi mynd. Virkilega flott  glæsilegar tæknibrellur. Stórfengleg mynd. Solid mynd fyrir Star Wars aðdáendur  topp afþreying. etta var fínn endir á þessari sögu, þessum Star Wars kafla  náðu að loka þessu ágætlega. Scifi nördinn í mér hefur alltaf gaman af öllum þessum plánetum í Star Wars heiminum með mismunandi dýrum og geimverum. Sum atriði og samtöl voru smá Disneyleg  smá kjánalegvandræðaleg að reyna að vera of krúttleg eða fyndin. Gaman og áhugavert að sjá hvað J.J. Abrams er duglegur að redda hlutverkum fyrir vini sína sem hann hefur unnið með í sjónvarpsþáttunum sínum."
838,851,7,"Töff mynd. Spennandi. Góð keyrsla. Svakaleg byrjun  intense  over the top. En gaman að þessu. Fylgir alveg Michael Bay formúlunni: Nóg af sprengingum, eldi, slowmotion, blóðslettum á sterum, rokktónlist, byssubardögum, bílaeltingaleikjum... og smá vörulaum product placement. Handritið var smá takmarkað á köflum."
839,852,7,"Mjög áhugaverð mynd. Frumleg. Kom mikið á óvart  hressandi þegar margar myndir eru oft nokkuð fyrirsjáanlegar. Fyrri hlutinn var ágætlega hægur og viðburðalítill, en svo tóku þau þetta á næsta level, skiptu alveg um gír. Góður húmor inn á milli. Alltaf gaman að sjá myndir sem fylgja ekki týpískum Hollywood formúlum."
840,853,6,hugaverð saga. Skemmtilegt scifi. Spennandi. Tímaflakk er flókið fyrirbæri  oft erfitt að skrifa handrit sem gengur alveg upp og meikar sense. En ágætis concept.
841,854,5,Spennandi thriller. Að vissu leyti áhugaverð saga og áhugaverður heimur. En mjög dark og brútal  meira en ég bjóst við.
842,855,8,hugaverð dystopian scifi mynd. Spennandi. Fín keyrsla. Töff bardagaatriði og myndataka. Skemmtilegar tæknipælingar.
843,856,10,Geggjuð myndataka! essi löngu skot eru svakaleg! Hef ekki séð annað eins. Metnaður. Listaverk. Bravissimo! essi myndataka gerði það að verkum að manni fannst maður vera með þeim í þessu  immersive upplifun sem var alveg mögnuð. Mjög spennandi. Flottir leikarar. takanlegt hvað stríð er klikkað dæmi  algjör bilun. Svo vel gerð og vönduð mynd  allt umhverfið virkar mjög authentic. Meistarastykki! Svo sannarlega mynd sem skilur eitthvað eftir  ég var alveg dolfallinn eftir þetta.
844,857,6,nægjuleg mynd. Fínn húmor. Góð keyrsla. Stutt og laggóð  hentugt fyrir fyrstu bíóferð Anítu. slenska þýðingin er Hvolpasveitin: OfurHvolpar. 
845,858,6,"Góð skemmtun. Góð nostalgía  þetta togaði alveg í réttu strengina með sömu töktunum, sömu tónlistinni o.s.frv. Töluvert meiri keyrsla og betra action eftir hlé  og þetta var alveg frekar gott action. Fínn húmor inn á milli. "
846,859,9,"Virkilega töff mynd. Back to basics hjá Guy Ritchie  í anda Lock, Stock and Two Smoking Barrels og Snatch með mjög gott handrit, skemmtilegar og áhugaverðar persónur og töff löng UK gangster samtöl  monologues. Mjög fyndin og spennandi  Guy Ritchie nær svo vel að blanda saman action og breskum húmor. Vel sett upp og góð keyrsla  hélt athygli manns vel."
847,860,6,"Fín skemmtun. Fínasta action  en mér fannst vanta smá taktinn í sum bardagaatriði, þau voru ekki alltaf nógu trúverðug. Kjarninn í myndinni var aðeins öðruvísi en mér fannst stiklan gefa til kynna. að var nokkuð áberandi að flestir áttu við geðræn vandamál að stríða  mikið af geðsjúkum persónum. Skemmtilega svartur og klikkaður húmor."
848,861,6,"hugaverð heimildamynd. Taylor er mögnuð listakona. Alltaf gaman að sjá bak við tjöldin, hvernig sköpunarferlið er þegar fólk býr til tónlist."
849,862,6,"Umfram allt mjög spennandi mynd. Mjög creepy og mikið af spennuþrungnum atriðum sem fengu adrenalínið til að flæða og hélt manni alveg á sætisbrúninni. Elisabeth Moss var klárlega stjarna myndarinnar  náði mjög vel að túlka þessa brotnu taugahrúgu. Kvikmyndataka, tónlist og annað hljóð hjálpaði mikið við að skapa spennuna og manni brá alveg nokkuð oft."
850,863,6,Spennandi. Gott löggu  bófa  frekar klassísktformúlukennt. hugavert að sjá Post Malone í smá hlutverki. netflix 
851,864,7,Svakaleg saga. Magnað hvað þetta virðist hafa verið toxic vinnuumhverfi. Heill hellingur af frábærum leikurum. Sagan var aðeins öðruvísi en trailerinn og annað markaðsefni gaf í skyn.
852,865,6,Töff scifi mynd. hugavert concept. Spennandi. Endirinn hefði getað verið betri  vantaði eitthvað til að gera hann meira solid. hugavert að sjá að  mínútur af kreditlistanum voru þakkir til þeirra sem styrktu myndina í gegnum Indiegogo ???? 
853,866,7,Fyndin vitleysa. Spennandi og fínt action. Góð afþreying. netflix 
854,867,6,Hugljúf mynd. Fyndin á köflum. Drama. Mjög væminn endir.
855,868,6,"Mjög spennandi. gætis saga og plot, en endirinn hefði getað verið örlítið betri. netflix "
856,869,7,Spennandi. Góð keyrsla inn á milli. Töff action myndataka með flottum oneshots. netflix 
857,870,7,"Mjög fyndið bull. Jojo var krúttlega barnalegur naive. Sam Rockwell var sérstaklega góður og fyndinn. Mjög góð og skemmtileg mynd. En hún var líka alveg smá spennandi, dramatísk og sorgleg  sem er viðeigandi fyrir þetta umræðuefni."
858,871,7,Fyndin og spennandi. Svona romcom með spennuaction twist er formúlan okkar Birnu fyrir datemynd. netflix 
859,872,6,Gangsta mynd. Gangsta gellur. New York í ruglinu. Spennandi mynd.
860,873,7,Skemmtileg mynd. Fyndin vitleysa. Alltaf gaman að sjá sland og íslenska leikara í stórum myndum. Alveg ágætis saga  ekki alveg eins innantómt og ég bjóst við. Fullt af cameos. Fínasta afþreying. netflix 
861,874,7,Fyrsta bíóferðin í  mánuði! ???? etta var mjög spennandi mynd. Svakaleg bardagaatriði. Gott action. Brútal. Ruglað hvað það er ungt fólk í hernum sent í svona aðstæður  það voru  árs krakkar þarna...
862,875,8,Spennandi mynd. hugaverð saga. Drama. Fínasta keyrsla tempo. Flottir leikarar.
863,876,8,Mjög spennandi mynd. Gott action. hugaverð sagaplotconcept. Töff mynd. Góð keyrsla inn á milli alla vega. Gaman að sjá Netflix myndir með gott budget. netflix 
864,877,7,"Mjög spennandi mynd. Alltaf gaman að sjá mismunandi útfærslur á zombie hugmyndinni. Töluvert öðruvísi plot en forverinn, Train to Busan  fleiri sögupersónur og gerist á fleiri stöðum en bara í einni lest ???? etta er að hluta til teiknimynd  það leit út fyrir að öll bílaaction atriðin voru  tölvuteiknuð. annig að þetta var stundum eins og að horfa á tölvuleik ???? En þetta var töff action. Mikið og langt drama í lokinn."
865,878,8,Mjög fyndin mynd. hugaverð hugmynd  fínasta twist á Groundhog Day. Gott stöff. Mjög skemmtileg  góður söguþráður. Góðar týpur. Bestu atriðin voru svona ekta Lonely Island húmor.
866,879,7,"Gott action. Spennandi. hugavert concept. Gaman að sjá Casey Neistat í smá cameo. Líka áhugavert að sjá Machine Gun Kelly Colson Baker í smá hlutverki. Random trivia: Casey og Colson léku einmitt báðir í myndinni Nerve. gætlega formúlukennt, en fínasta afþreying. netflix "
867,880,8,Mjög spennandi mynd. Stressandi. Liggur við að þetta sé meiri hryllingsmynd en spennumynd. Meira brútal en ég bjóst við. Russell Crowe var alveg psycho  þessi ólgandi reiði skein mjög vel í gegn. Klikkuð keyrsla alveg frá byrjun. Nokkuð fersk og frumleg mynd.
868,881,6,Spennandi mynd. Skemmtilega evrópskur bragur á action atriðunum  sem voru mörg mjög töff. Fínasta plothandrit. netflix
869,882,9,"Loksins sá ég Tenet! ???? Geggjuð mynd. Mjög spennandi. étt keyrsla. Töff action atriði, en nokkuð flókið að fylgjast með þeim út af ploti myndarinnar. Mögnuð hugmynd að sögu  bræðir smá heilann að reyna átta sig á þessu ???? Líka mjög áhugavert að pæla í kvikmyndatökunni og leiknum til að láta þetta allt ganga upp. Virkilega góð mynd eins og Christopher Nolan er lagið."
870,883,4,Svo klisjukennt og fyrirsjáanlegt. Lélegtskrýtið handrit. Kjánaleg mynd. En stundum er gaman að horfa á lélegar myndir. netflix
871,884,5,Steikt og kjánaleg mynd  en á skemmtilegan máta. Ekkert verið að taka sig of alvarlega  bara verið að leika sér með tímaflakk. gætlega fyndin inn á milli. Nokkur skemmtileg cameos. Fínasta afþreying.
872,885,3,nnur klisjukennd og fyrirsjáanleg mynd. Ekki gott handrit  mikið af vandræðalegum og þvinguðum væmnum atriðum. netflix
873,886,7,Feelgood fjölskylduvæn hasarmynd á léttu nótunum. Mjög fyndin inn á milli. Aðal strákurinn var mjög góð týpa. gætlega spennandi. Mjög solid afþreying. netflix
874,887,6,Mikil vitleysa. En alveg fyndin inn á milli. Ekta Family GuySeth MacFarlane húmor. Slatti af fínum leikurum  skemmtilegum cameos. netflix
875,888,6,Spennandi mynd. Skemmtileg. Enola Millie Bobby Brown er góð týpa. Gaman af svona spæjara finnavísbendingar myndum. netflix
876,889,4,Væmin. Klisjukennd. Frekar fyrirsjáanleg. Ekkert svakalega gott handrit  oft þurr og vandræðaleg samtöl. Fín áminning að það er ýmislegt sem gefur til kynna að það sé betra að horfa á björtu hliðarnar og vona það besta.
877,890,5,"Skrautlegar persónur. Smá Bmynda bragur. Inn á milli frekar lélegur leikur og jafnvel eins og það sé talsett eftir á fyrir suma leikarana. Mikið ofbeldi. Brútal. Svartur og skrýtinn húmor. Stundum ákveðnar gloppur í handritinu  upp á trúverðugleika, flæði og að meika sense. En alveg spennandi mynd. Langt síðan maður hefur séð eitthvað frá Jonas kerlund. hugavert að Deadmau sá um tónlistina. netflix"
878,891,6,Svartur húmor. Smá spes mynd. Slatti af cameos og þekktum leikurum. Spennandi og fyndin. netflix
879,892,7,"Töff mynd. Klikkuð og brútal sýn á LA. Spennandi. Var búinn að gleyma að Snoop Dogg, Dr. Dre. og Macy Gray voru með smá hlutverk."
880,893,6,Mikið bull. Kjánalæti í takt við aðrar Adam Sandler myndir  mér fannst ég vera horfa á persónur úr gömlum Sandler myndum. Slatti af cameos og þekktum leikurum í litlum hlutverkum. Alveg smá spennandi og fín afþreying. netflix
881,894,7,Mjög spennandi. hugavert plot. Svartur húmor.
882,895,6,Mjög spennandi. Gott action. gætis saga og plot. Passlega stutt mynd. netflix
883,896,6,nnur Kóresk zombie mynd. Skemmtileg nútíma nálgun á zombie mynd. Mjög spennandi og stressandi. Fínasta zombie action. netflix
884,897,6,Missy er mjög klikkuð týpa  alveg skemmtilega klikkuð. Mikið bull. Mikil vitleysa. En betri mynd en ég bjóst við. Slatti af klassískum Happy MadisonAdam Sandler leikurum. netflix
885,898,6,Nokkuð hæg mynd  tók smá tíma að ná flugi. Mikið New York vibe  var að fíla það. Quirky húmor  mjög fyndin inn á milli. En líka létt drama. Bill Murray var algjör snillingur  mjög góð týpa.
886,899,7,Mjög áhugaverð saga. Spennandi. Fyndin inn á milli. Solid handrit og samræður eins og maður býst við frá Aaron Sorkin. Kraftmiklar persónur. Fullt af fínum leikurum. netflix
887,900,7,Gott stöff. Góðar persónur. hugaverð saga. Klikkað hvernig stemningin og virðingarleysið var þarna í s. Vel gerð mynd.
888,901,7,Mjög spennandi stríðsmynd. Tónlistin og hljóðin voru áhugaverð  gerðu þetta extra spookystressandi. að var líka smá eins og þetta væru dýrahljóð tengd skipunum og kafbátunum. Skemmtilega takmörkuð prímatív tækni sem þeir voru að vinna með þarna. hugavert að Tom Hanks skrifaði handritið.
889,902,5,Hugljúf og væmin s mynd. Drama  táningsdrama. Stundum voru frekar takmarkaðir leikarahæfileikar í gangi.
890,903,6,Mjög spennandi frönsk löggu  bófa mynd. Smá ruglingslegt hver er að svíkja hvern. Aðeins of dark og WTF á köflum. netflix
891,904,7,Skemmtileg mynd. Fyndin á köflum. Jim Carrey var góð týpa  klassískir taktar hjá honum. Spennandi  ágætlega fjölskylduvænt action. Flottar tæknibrellur.
892,905,7,"Vel ruglað bull. Oft mjög vandræðaleg cringey atriði. Alveg sniðugur clever húmor inn á milli. En margt svo rangt. Stundum virtist þetta vera lauslega tengdur söguþráður og meira eins og sería af sketsum  en kannski bara svipað og Borat . Dóttir hans Maria Bakalova var mjög góð í sínu hlutverki. Kom skemmtilega á óvart að þetta var í rauninni um jafnrétti kynjanna. hugavert að sjá fullt af fólki á creditlistanum sem COVID Advisor, COVID Compliance Officers o.s.frv.  munum örugglega sjá meira af því í kringum myndir sem eru teknar upp á þessum tímum."
893,906,5,"hugavert concept. Fyndin inn á milli. Smá hæg á köflum  ekkert svakaleg action keyrsla. ar sem Related movies voru Spy, The Spy Who Dumped Me og Date Night sem eru allar í uppáhaldi hjá okkur þá bjóst ég við öðruvísi mynd  meira action og betra gríni. etta var meira svona romcom með drama."
894,907,5,"Ekki frábær mynd, en ekki hræðileg. Fyrirsjáanleg og klisjukennd, en mjög fyndin inn á milli. Allt í lagi afþreying. hugavert að sjá King Bach Andrew Bachelor í fleiri og fleiri myndum  það er vissulega verðmætt að fá áhrifavald með meira en  milljón fylgjendur til að tala um kvikmyndina þína ???? netflix"
895,908,7,"Fín ofurhetjumynd. Spennandi. Kröftug á köflum  það var meiri kraftur í fyrri myndinni. Wonder Woman er töff karakter. Kristen Wiig kom líka fersk inn  aðeins meira en klassísku gríntýpurnar hennar. Stundum vantaði eitthvað  kannski í handritið eða tempóið. Skemmtilegt s vibe, en hefði verið best ef þetta hefði verið WW ???? "
