,id,rating,review
441,448,6,Fínasta indie mynd. hugaverð og skemmtileg saga. Fyndin. Krúttlegur indie bragur. Gaman að sjá Josh Ruben bregða fyrir sem maður hefur verið að fylgjast með á TumblrCollege Humor.
442,449,8,Algjör snilld. Spennandi. Gott action. Arnold Schwarzenegger er ennþá með þetta : Mjög góður húmor. Virkilega fyndin á köflum  fullt af fínum oneliners. Góð blanda  action og húmor. Fullt af fínum leikurum.
443,450,6,Fyndin mynd. Nett rugluð. Samt eitthvað sem vantar... handritið hefði kannski mátt vera betra og persónurnar meira solid. Jason Segel og Phyllis Smith stóðu sig eiginlega best.
444,451,6,"gætis splatter mynd. Fínasta action  smá kungfu bardagar. hugaverðar græjur og vopn sem þau voru með. Nokkuð fyndin á köflum  stundum af því að þetta var svo extreme : g var að fíla Edward : Fínasta afþreying. Leikstjórinn og handritshöfundurinn, Tommy Wirkola gerði líka Dead Snow  maður sá alveg svipaða takt í þessum myndum skrímsli og gore."
445,452,6,"gætlega fyndin mynd. Nett rugluð. gætis afþreying  léttmeti. Maður hefur séð þetta concept áður Freaky Friday, et. al.. Svo er náttúrulega falleg lexía í þessu um lífið og hamingjuna  peningar eru ekki allt und zo weiter."
446,453,6,Fyndin. Dash rómantísk. Smá drama. Slatti af fínum leikurum. gætis sagahandritplot.
447,454,7, ensku: Headhunters. Mjög spennandi. Gaman að sjá svona flottar skandínavískar myndir. gætis plot. Gott action. Nett rugluð og brútal á köflum.
448,455,7,Mjög spennandi. Skemmtileg. Kúl special effects. Að vissu leyti klassískt handrit  alla vega brot sem maður kannast við ; J.J. Abrams og Steven Spielberg eru gott teymi. 
449,456,6,Rómó. Sexy. Fyndin.
450,458,6,"Gott action. Að vissu leyti klassísk Die Hard formúla  vondir kallar, oneliners, byssur, sprengingar, bílaeltingaleikir... En mér fannst eitthvað vanta. g bjóst við meira. Handritið var frekar takmarkað. Die Hard  er fínasta afþreying samt sem áður."
451,459,6,Fyndin mynd. Spennandi. Klassískt grín rugl. Melissa McCarthy er snillingur : Gott stöff.
452,460,8,Skemmtilega flippuð og skrýtinquirky mynd. Skemmtilegar persónur  skemmtilegt líka hvernig þær voru kynntar. Gaman hvað Amélie var með fjörugt ímyndunarafl : Hugljúf og skemmtileg mynd.
453,461,7,Spennandi mynd. Intense. Drama. Fínasta action  sérstaklega í lokinn. hugaverðar persónur. Nokkuð gott handrit  sniðug saga.
454,462,7,"Mjög spennandi mynd. Gott action. hugaverð saga. Slatti af þekktum leikurum. Að vissu leyti formúlumynd eins og margar aðrar, en vel framkvæmd. Góð keyrsla."
455,463,6,Hugljúf mynd : Ekkert yfirþyrmandi væmin og nokkuð spennandi. gætis saga. Smá í lokinn reyndar sem mér fannst skemma smá heildarupplifunina. Fínasta stefnumótamynd.
456,464,7,"Fínasta action mynd  fullt af töff atriðum. Nóg af sprengingum : Góð keyrsla. Nokkur atriði sem voru sérstaklega töff í D  svona  nei, það er byssukúla á leiðinni í áttina að mér! ;"
457,465,7,"Mjög spennandi  magnaður thriller. Fínasta handritplot. Mér fannst þetta vera töluverð ádeila á lyfjaiðnaðinn og kúltúrinn í kringum það að lyf séu lausnin við öllu. Vel leikstýrð, eins og má búast við hjá Steven Soderbergh. Fegurð. Góðir leikarar."
458,466,8,"Mögnuð mynd! Rosalega spennandi  sérstaklega Osama bin Laden atriðið. Intense. Töff tónlist. Frekar löng, en samt kúl. Góðir leikarar. Vel leikstýrð mynd, leit mjög vel út."
459,467,7,Hörku spennumynd. Góð keyrsla og töff actionstórslysa atriði. Fullt af fínum leikurum. Reyndar nokkrar holur í handritinu svona Af hverju gerðu þeir þetta svona?Af hverju gerðu þeir þetta ekki svona?  en óþarfa að stressa sig of mikið á því með svona poppkornsmyndir ; Vel gert hjá Katrínu Benedikt að skrifa handrit fyrir svona risastóra mynd.
460,468,8,"Rosalegt action. Rosaleg spenna. Rosaleg keyrsla. Rosalega góðir leikarar. Rosaleg mynd. Magnaðar tæknibrellur. Dúndrandi skemmtun. essi Marvel heimur er magnaður  alltaf að tengjast meira og meira og bætast við fleiri myndir... að var vissulega slatti af product placement vörulaum eins og gengur og gerist í svona risastórum myndum  en mér fannst áhugavert að sjá SpeedTest.net þarna, kom mér á óvart : Fyrir þá sem hafa áhuga á því þá er atriði eftir creditlistann  Ekkert mustsee, en smá skemmtilegt."
461,469,7,Skemmtileg mynd. Fyndin. Skemmtileg saga  góðar persónur. Flott  grafíkin leit vel út. Góðir leikarar.
462,470,6,Skemmtileg vitleysa. Fyndin á köflum alla vega. Fínasta afþreying. g hef alltaf gaman af mynum sem gerast í New York :
463,471,7,"Spennandi. Gott action. Að vissu leyti stórslysamynd  sprengingar, eyðilegging og læti. g hef gaman af svona scifi myndum  áhugaverðar pælingar varðandi hvernig heimurinn verði eftir X mörg ár. D effectarnir voru smá kúl, sérstaklega credit listinn í lokinn. En ég var reyndar orðinn frekar þreyttur í augunum í lokinn, tekur á að horfa á  mín. D mynd ;"
464,472,7,"Gott action. Töff bílaatriði. Spennandi. Fínasta afþreying  maður á líka að horfa á þetta þannig, og ekki láta ótrúverðug atriði og þunnt handrit trufla sig of mikið ; Myndin missti smá kraftmomentum á köflum  stundum ekki alveg nógu gott flæði."
465,473,7,Skemmtileg vitleysa. Spennandi. Gott fjör. Fyndin. tti að slá í gegn hjá þeim sem fíluðu hinar myndirnar. En það er held ég bara gott að þetta er síðasta myndinn í seríunni  það væri líklega aðeins of mikið aðeins of þreytt ef það væru gerðar fleiri Hangover myndir.
466,474,7,Mjög spennandi. Skemmtileg saga. Töff trick. Fínasta afþreying.
467,475,7,"Fyndin vitleysa og fínn hasar. g var ekki alveg viss með þessa mynd fyrir hlé... var alltaf að bíða eftir meira action, meira fútti, meiri keyrslu. En eftir hlé breyttist þetta í bullandi svarta kómedíu : Skemmtileg vitleysa  ágætis afþreying. Slatti af fínum leikurum í aukahlutverkum."
468,476,6,Fyndin vitleysa. hugaverð blanda; zombie action spennu rómantísk gamanmynd ; Spennandi. Sérstakarskemmtilegar persónur. g áttaði mig ekki strax á að þetta er svona smá zombie útgáfan af Rómeó  Júlíu...
469,477,6,"Fyndin. Hugljúffeelgood mynd. Skemmtileg saga, þótt hún sé að vissu leyti formúlukennd. g er forvitinn að vita hversu mikið Google kom að gerð myndarinnar  í raun ágætis auglýsingbranding fyrir Google. g er að spá hvort þeir hjá Google hafi séð athyglina sem Facebook fékk í kringum The Social Network og þeir hafi viljað fá sína eigin mynd ; Mér fannst skemmtilegt hvernig þau notuðu ýmsar Google vörur til að birta credit listann í lokinn."
470,478,7,"Mjög kúl mynd. Töff action atriði  mörg risastór og áhrifamikil impressive. Nokkuð fyndin inn á milli kom smá á óvart. Mér fannst koma ágætlega út hvernig þeir hoppuðu fram og til baka í æsku Clark KentKalElSuperman. Michael Shannon var góður sem vondi kallinn. Tónlistin var flott  Hans Zimmer er meðetta. Góð saga, skemmtileg útfærsla á Superman heiminum  ég væri til í að sjá meira."
471,479,6,gætis afþreying. gætlega fyndin. Silly. Mér fannst töluvert verið að skjóta á David Blaine og aðra sambærilega gaura.
472,480,7,"Mjög spennandi mynd. Hörku action  góð keyrsla. Slatti af þekktum leikurum. Leit vel út  flott myndataka og leikstjórn. Roland Emmerich missti sig reyndar aðeins í væmni og Ameríkudáð í lokinn eða sá sem bar ábyrgð á því.

Mjög svipað concept og Olympus Has Fallen, en mér fannst þessi kannski aðeins betri  alla vega að sumu leyti."
473,481,6,Vandræðaleg mynd. Duplass bræðurnir eru líklega svolítið fyrir svona vandræðaleg og raunveruleg samtöl. Smá drama. Kjánalega fyndin. Indie. gætis saga.
474,483,7,Mjög spennandi og fyndin. En algjört rugl. Fyndið rugl. Skuggalega súr  allnokkur WTF?! atriði. Fullt af skemmtilegum cameos. rátt fyrir töluverðan súrleika þá var þetta umfram allt góð skemmtun : Líka falleg skilaboð ;
475,484,8,"Rosalega spennandi mynd! Hörku action. Mjög góð keyrsla. Vel leikstýrð, flott myndataka og leit vel út. Nokkur atriði sem komu ágætlega velskemmtilega út í D. hugaverður söguþráður. Mér finnst zombie hugmyndafræðin mjög skemmtileg. etta var áhugaverður vinkill  uppvakningarnir í þessari mynd voru brjálaðari, kraftmeiri og árásargjarnari heldur en í öðrum zombie söguheimum eins og t.d. sjónvarpsþáttunum The Walking Dead. Sem gerði þetta að vissu leyti meira spennandi af því að það var minni von, meiri hætta, meiri óvissa. Mjög góð mynd. Kúl stöff. Fullt af fínum persónum og leikurum. Brad Pitt var töffari."
476,485,7,Mjög fyndin mynd. Spennandi. Melissa McCarthy er svo mikill snillingur  leikur alltaf mjög skemmtilegar persónur. Gott handrit  fullt af snilldar línum og atriðum. Topp afþreying.
477,486,6,"Fínasta afþreying. gætt action og nokkuð spennandi á köflum. Fyndin. Nokkur atriði þar sem var smá random en töff myndatakaklipping. Flottir leikarar  snilld hvernig John Malkovich getur tjáð sig með svipbrigðum. En það vantaði samt smá upp á heildina, til að gera myndina meira solid  betra flæði, betra handrit... eitthvað."
478,487,7,"hugaverð vísindaskáldsaga. Nokkuð spennandi. Sagan var reyndar smá ruglingsleg  það hjálpaði að lesa Wikipedia greinina eftirá til að átta sig betur á þessu ; Tónlistin var nokkuð kúl  flott að fá M til að semja tónlistina fyrir myndina, smá elektró í þessu ; Smá TronDaft Punkt stemning, en samt alls ekki eins. Rosalega flott mynd, leit vel út  vandað til verka þar. Alltaf gaman að sjá sland í bíómyndumsjónvarpsþáttum  þetta er svo mögnuð náttúra, mjög myndræn :"
479,488,5,hugaverð heimildamynd. Sýnir hvað  hrunið breytti öllu  bara aðeins öðruvísi vinkill ; hugaverðar persónur. Smá klikkað að hún hélt áfram að eyða í óþarfa hluti þegar þau voru í óvissu með peningana sína ættu að vera að spara. Mjög sérstakur lífstíll.
480,489,6,"gætis grínmynd. Fínasta saga, þótt hún hafi verið að vissu leyti formúlukennd og fyrirsjáanleg. Fínir leikarar."
481,490,7,Fínasta afþreying. Fyndin  spennandi. gæt saga. Dash af action og dash af gríni  góð blanda. Denzel Washington og Mark Wahlberg eru topp leikarar. eir voru góðir saman. Baltasar er meðetta  gaman að sjá hvað hann er að gera góða hluti.
482,491,5,"Nett klikkuð mynd. Smá spes klippingflæði  eiginlega eins og flashforwards og flashbacks audio ogeða visual fram og til baka. Blandaði söguþræðinum smá saman, en að vissu leyti áhugaverð aðferð, setti smá stíl á myndina. Töff tónlist. Handritið var frekar takmarkað. Sæmileg heilalaus þynnkumynd."
483,492,7,Skemmtileg mynd og hrífandi. hugaverð og mögnuð saga. Fullt af fínum leikurum.
484,493,5,"Jájá, fín mynd. Action og læti. Sly grjótharður. Enginn topp leikur í gangi."
485,494,6,Spennandi. gætis action. Brútal ofbeldi veit ekki hvort það hafi verið sniðugt að ég hafi verið svona ungur þegar ég sá hana fyrst. Snilldar línur ; Skemmtilega hallærislega gamaldags. Eldist sæmilega.
486,495,5,"hugaverð mynd. Spennandi. Twisted. Klikkuð. Ekki alveg feelgood mynd ; Skemmtilegt að sjá lög með Gísla Pálma í myndinni. gætt að hún var bara  mín., hefði ekki nennt að horfa á mikið lengri útgáfu af þessari mynd. 

 g sá þessa mynd í flugvél."
487,496,7,Töff mynd. Spennandi. Gott action. hugaverð vísindaskáldsaga  enn og aftur er spáin fyrir framtíðina ekkert rosalega björt ; Topp afþreying.
488,497,6,Eða Malavita eins og hún virðist vera kölluð í Evrópu. gætis afþreying. Nokkuð skemmtilegar persónur. Glettilega fyndin á köflum. Mér fannst smá metnaðarleysi í handritinu  þá aðallega í kringum eitt atriði. gætlega spennandi.
489,498,7,Mjög fyndin mynd : Spennandi. Fínasta action. Gott fjör. Mjög fín scifi skemmtun. að var alveg smá Shaun of the DeadHot Fuzz stemning í þessari mynd. Skrýtið að þessi mynd fari ekki í almenna sýningu í bíóhúsum hérna. En gaman að ná henni á einni af þessum örfáu sérsýningum.
490,499,6,"Voða krúttleg, en samt smá þung indie erfitt að vera táningur kvikmynd."
491,500,7,ff... átakanleg mynd. Dark. Langt frá því að vera hugljúfhappygolucky. En hún var spennandi og vel leikin. Fínt handritplot. Fínasta leikstjórn og myndataka. Frekar dökk áferð á myndinni. að var nokkuð þungt yfir fólki þegar það yfirgaf bíósalinn... Kæmi ekki á óvart ef þessi mynd fengi einhverjar skarstilnefningar.
492,501,9,"Rosalega spennandi! Intense. Töff tónlist, gerði mikið fyrir stemninguna. Góðir leikarar. Myndin leit vel út. Flott myndataka. Glæsileg tölvugrafík  mjög raunveruleg. D var að koma ágætlega út á köflum. Gaman að sjá slatta af slendingum á credit listanum. Mögnuð mynd, gott stöff. "
493,502,7,"Spennandi. Gott action. Fullt af flottum tæknibrellum. Alltaf gaman að sjá smá íslenskt landslag í svona risastórum kvikmyndum. 

By the way, það er smá auka atriði í lokinn eftir credit listann."
494,503,6,hugaverðar pælingar. Setja sér markmið. Sjá þau fyrir sér og hafa augun opin fyrir tækifærum. Hefur virkað hjá mér að vissu leyti ;
495,504,7,Spennandi mynd. hugaverð saga. Góðir leikarar. Drama.
496,505,5,"Spennandi. hugavert plot, en smá skrýtið ruglingslegt. Endirinn var ekki alveg nógu satisfying. Smá súr kvikmyndastíll. 

 g horfði á þessa mynd í flugvél sem getur skemmt smá upplifunina."
497,506,8,"Mögnuð mynd! Rosalega spennandi  eiginlega allan tímann. Drama  action  smá rómó. Góð saga og áhugaverðar persónur. Magnaður heimur sem er búið að búa til. ótt myndin sé ca. , klst. þá var hún langt frá því að vera langdregin  þetta leið mjög hratt  myndin var það spennandi og það góð keyrsla. Hélt manni alveg við efnið : Hlakka til að sjá restina af þessari seríu."
498,507,6,"Spennandi. Gott action. Ekta Jason Statham mynd þar sem hann er ótrúlega harður og lemur vondu kallana, klikkar ekki. Kom skemmtilega á óvart að Sylvester Stallone skrifaði handritið og framleiddi. "
499,508,7,"Fyndin mynd. Skemmtileg vitleysa. Klassískur Anchorman Will FerrellAdam McKayJudd Apatow húmor. Góð skot á Fox News og aðrar innihaldslausar og öfgafullar fréttir. Fullt af snilldar cameos. að er smá auka brot í lokinn eftir credit listann, ekkert brillíant, en gaman samt að sjá það."
500,509,8,"Virkilega flott mynd. Mjög spennandi. Gott action. etta er risastór og magnaður heimur sem er búið að búa til  mögnuð upplifun að horfa á þetta sérstaklega í D og  römmumsek. Flott myndataka og góð keyrsla. Mjög visualsjónræn mynd  allt leit mjög vel út; búningar, umhverfi, tæknibrellur o.s.frv. Sérlega skemmtileg ævintýramynd. ótt hún sé mjög löng  mín. þá var hún ekki langdregin  hélt alveg athygli manns. 

Vissulega framhald af fyrstu Hobbit myndinni í þessum þríleik þannig að hún var að mörgu leyti svipuð. Hlakka til að sjá þriðju myndina  og fá alvöru endi á þessa sögu ;"
501,510,7,"Skemmtileg mynd. Gott grín. Skemmtilega súr á köflum. Gaman að sjá loksins þessa klassík. 

 Kvikmyndaklúbburinn Leslie Halliwell horfði saman á þessa. "
502,511,8,"Mjög spennandi. hugaverð saga, sérstaklega þar sem hún er byggð á sannsögulegum atburðum. Fínir leikarar og persónur. Jason Statham er alltaf jafn mikill töffariharðhaus. Fínt action en umfram allt virkilega spennandi."
503,512,6,"Nett drama. hugaverð sagaconcept. Maður hefur það á tilfinningunni að þetta sé smá ádeila á hitt og þetta menningu, fjölmiðla, væntingar.... Flott myndataka og vel klippt. Fínir leikarar."
504,513,7,"Mögnuð saga. hugaverður heimur... algjör klikkun. Að þetta sé allt satt gerir þetta enn áhugaverðaraklikkaðara. Virkilega flott mynd Scorsese er náttúrulega snillingur og góðir leikarar. Margar skemmtilegar og áhugaverðar persónur. Mjög fyndin á köflum. Drama þar á milli. Martin Scorsese og Leonardo DiCaprio eru frábært teymi, búa til mjög góðar bíómyndir. Jonah Hill var líka mjög góður  lék skemmtilega klikkaðan karakter. Hélt manni ágætlega vel við efnið þrátt fyrir að vera  klst. löng."
505,514,8,"Rosaleg mynd! Mögnuð saga byggð á sannsögulegum atburðum. Virkilega spennandi. Intense og brútal  sérstaklega eftir hlé. Bardagaatriðin voru rosaleg... mögnuð  komu virkilega vel út, maður lifði sig smá inn í þetta ; Flott myndataka. Fullt af fínum leikurum. Topp mynd  vönduð. En svona stríð eru klikkuð..."
506,515,8,"Mjög skemmtileg mynd. g var að fíla zone out draumaatriðin : Töff special effects. Mjög flott myndataka. Mjög gaman að sjá sland og ýmsa íslenska leikara á stóra tjaldinu. Fyndin, hugljúf og smá spennandi á köflum. Skemmtileg saga. Flottir leikarar. Fullt af flottum ljósmyndum frá slandi sem birtust með credit listanum. "
507,516,6,Fyndin mynd. Fínasta afþreying. Hef samt séð skemmtilegri teiknimyndir með betri söguhandriti.
508,517,6,Fínasta action mynd. hugaverð endurgerð á klassískri mynd sem maður sá fyrst þegar maður var alltof ungur ; Gary Oldman var eiginlega besti leikarinn. Joel Kinnaman var líka töffari sem RoboCopAlex Murphy. Handritið hefði getað verið betra  vantaði smá fútt í þetta.
509,518,7,"Mjög skemmtileg mynd. Fyndin og spennandi. Fínasta saga. Slatti af þekktum leikurum þeir eru alla vega þekktir núna. Gaman að vera loksins búinn að sjá þessa mynd, maður hefur séð svo oft verið að vísa í hana á Internetinu. Til dæmis You keep using that word... sem er orðið meme og Hello, my name is Inigo Montoya. You killed my father. Prepare to die.. 


 Kvikmyndaklúbburinn Leslie Halliwell horfði saman á þessa."
510,519,5,"etta er ekki týpísk afþreying eins og margar bíómyndir eru. etta er meira listaverk  voða flott og að vissu leyti vandað, en maður þarf svolítið að spá í því til að átta sig á hvað listamaðurinnlistamennirnir eru að reyna miðla. 

að var ekki mikil gleði í þessari mynd.  raun allt ömurlegt hjá þessum gaur. Drama. unglyndi. gætlega kúl Instagramvintage filter á myndinni ; Lúmskt skopleg á köflum. Skemmtilega skrautlegar persónur, eins og eru oft í Coen myndum. Vissir kaflar í sögunni voru áhugaverðir, en á heildina litið þá vantaði einhvern kjarna í söguþráðinn. "
511,520,7,"Hörku spennumynd. Góður hasar. Liam Neeson er töffari. Fínasta plot, en þetta var að vissu leyti formúlumynd. Ekkert gríðarlega frumleg, en nokkuð vel framkvæmd. "
512,521,6,Skemmtileg vitleysa. Gott grín. Fullt af fínum leikurum. Fínasta afþreying.
513,522,5,"Mér fannst handritið ekki nógu gott. Margt skrýtiðkjánalegt og flæðið á milli atriði var stundum ekki nógu lógískteðlilegt. ar sem þetta er Luc Besson mynd þ.e.a.s. hann skrifaði handritið og framleiddi þá voru vissulega franskir bílar í eltingaleik. 

að voru nokkur atriði sem voru ágætlega fyndin og nokkrar action senur ágætlega kúl. En það var kannski verið að reyna blanda of mörgu saman; action, grín, rómantík, spenna, drama... Hálf stefnulaust  gekk ekki upp. Gaman að sjá Tómas Lemarquis í nokkuð stóru hlutverki."
514,523,9,"Mögnuð mynd. Risastór. Virkilega spennandi. Drama. Mjög töff action atriði. hugaverður ævintýraheimur. Vel leikin  enda einvala lið leikara. Nick Nolte stóð sig vel sem gamall steinn, röddin mjög viðeigandi. 
 
slenska náttúran var mögnuð í sínu hlutverki  endalaust af fjölbreyttri fegurð. Mér fannst sland gera rosalega mikið fyrir þessa mynd  gerði hana að enn meira listaverki. Myndin leit mjög vel út  búningar, umhverfi o.s.frv. 
 
Mér fannst þetta smá ádeila á kjötætur  að öll dýr eigi rétt á að lifa. Svo var þetta líka áróður fyrir því að passa upp á náttúruna."
515,524,7,Myndin kallast Dead Snow: Red vs. Dead á ensku Fyndin vitleysa. Nokkurs konar Nazizombiesplatter grín. Mörg atriði nokkuð fyndin og svo nokkur atriði frekar súrfáránleg en þau voru stundum líka bara fyndin. Mjög svartur húmor. Sum atriðin voru frekar brútal gore. Skrautlegar og skemmtilegar persónur. Alltaf gaman að sjá sland í bíómyndum og helling af slendingum á credit listanum.
516,525,5,Drama um lífið og tilveruna. Nokkur skopleg atriði.
517,526,9,"Mjög fyndin mynd. Fullt af kómískum atriðum og orðasamskiptum. Gott handrit. Skemmtilegar og skrautlegar persónur  og nóg af þeim. Fullt af þekktum og góðum leikurum sjaldan sem maður sér svona marga þekkta leikara í einni mynd. 

Fínasta keyrsla flæði og áhugaverður söguþráður. Spennandi. Leit vel út  skemmtileg stemning, skemmtilegir litir. etta var smá eins og barnaævintýri fyrir fullorðna. Mjög vel leikstýrð. Listaverk. Wes Anderson er með einstakan og skemmtilegan stíl."
518,527,4,Enn önnur mynd um hvað lífið getur verið erfitt og fólk á stundum erfitt með að finna sig. Drama. Aðeins of þungt yfir þessu til að vera ánægjulegt að horfa á. Indie bragur af þessu. gætlega áhugaverður söguþráður á köflum. Ekki mikið af skemmtilegum persónum. 
519,528,6,"Flottir bílar í eltingaleik. gætlega spennandi þrátt fyrir að vera frekar fyrirsjáanleg formúlumynd. Ekki eins góð og Fast  Furious myndirnar. Mér fannst handritið ekki nógu gott  það vantaði alla vega eitthvað til að gera þessa mynd betri hrífa mann meira, meiri upplifun. að var eitthvað kjánalegt við Michael Keaton og hans persónu. "
520,529,8,"Góð action mynd. Risastór action atriði og töff bardagaatriði. Flottar tæknibrellur. Nokkuð spennandi. Fínir leikarar  persónur, ágætis flæði og nokkuð gott handrit. Maður er byrjaður að læra að á eftir credit listanum í öllum Marvel myndum er eitt atriði til að tengja allan Marvel heiminn saman. að og að Stan Lee poppar alltaf upp :"
521,530,6,Nokkuð fyndin. hugaverð saga.
522,531,7,"Brjálæðislega fyndið rugl. Mikið af óviðeigandi bröndurum sem myndu líklega ekki ganga í bíómynd sem væri gefin út í ár. Stútfullt af góðum orðaleikjum og almennri vitleysu silliness. 
 
 Kvikmyndaklúbburinn Leslie Halliwell horfði saman á þessa. "
523,532,7,"Eða Bad Neighbours eins og hún kallast á slandi og víða um heim. Fyndin vitleysa. hugavert stríð í gangi, sem fer úr böndunum That escalated quickly.... Gaman að sjá The Lonely Island og Workaholics gaurana í smá cameo."
524,533,7,Góð mynd. hugaverð saga. Nokkuð gott handritplot. Fullt af fínum leikurum  í stóru og litlu hlutverkunum. Flott tónlist  gerði mikið til að skapa  stemningu. Myndin er víst lauslega byggð á sannsögulegum atburðum. Frekar löng  mín..
525,534,7,"Nokkuð góð skrímslastórslysamynd. Töluvert öðruvísi plot heldur en í Godzilla myndinni frá . Kom svolítið á óvart.  raun öðruvísi nálgun á Godzilla heiminnsöguna, en kannski nær upprunanlegu sögunni þekki það bara ekki nógu vel. Fínasta action. Spennandi. Mikið um eyðileggingu."
526,535,8,"Mjög spennandi og vel gerð action scifi mynd. hugavert twist á Groundhog Day pælinguna. Flott action atriði, flottar tæknibrellur og fínasta handritplot. að voru nokkur bardagaatriði sem komu skemmtilega út í D. Geimverurnar minntu mig smá á Sentinel vélmennin í The Matrix. Fínasti sumarblockbuster. "
527,536,6,Fyndin vitleysa. Fínasta afþreying.
528,537,6,Nokkuð fyndin. Flott gengi. Stundum borderline kjánaleg ;
529,538,7,Fyndin vitleysa. Bull og kjánalæti. gætis action inn á milli. Gaman að sjá Diplo í smá cameo. Skemmtilegt hvað þeir gerðu mikið grín að endurgerðum reboots og framhöldum. eir voru alveg meðvitaðir um að þetta var að vissu leyti formúlumynd og voru að gera grín að því. Mér fannst vera smá vísun í Whos On First sketsinn í lokinn  skemmtilegt. 
530,539,7,Vonarstræti á íslensku Mögnuð mynd. ung. Dramatísk. takanleg á köflum. Mjög vel leikin. Flott myndataka. hugaverð saga. Beittar skírskotanir í góðærið.
531,540,7,"Góð mynd. Flottir leikarar. Glæsileg myndataka. Leit vel út. Vönduð. Skemmtilegaráhugaverðar pælingar varðandi tæknina og framtíðina, möguleikar gervigreindar og AI samskipti. Mér fannst vera smá vísun í Blade Runner og muninn á vélmennumhugbúnaði og manneskjum. Skemmtileg saga. Litirnir og tískan fyrir þennan framtíðarheim var líka áhugavert. "
532,541,5,Fyndin vitleysa. g var reyndar að vonast eftir því að hún væri fyndnari. að vantaði kannski smá kraft í handritið og flæðið á sögunni. Fullt af þekktum leikurum. Klassískur karakter fyrir Melissa McCarthy.
533,542,8,"Mjög spennandi mynd. Gott action. Flottar tæknibrellur  aparnir voru magnaðir, ótrúlega vandað allt í kringum þá. hugaverð saga. Flottur ævintýraheimur. "
534,543,6,"Fyndin mynd. Nett rugluð bull, vitleysa og kjánaskapur. Sagan handritið var hálf þunn stundum  vantaði smá upp á til að gera myndina heilstæðari meira solid. Rosalegt vörulaum e. product placement hjá Apple."
